
Bus 001 Device 025: ID 1d50:6018 OpenMoko, Inc. Black Magic Debug Probe (Application)

Device Descriptor:
  bLength                18
  bDescriptorType         1
  bcdUSB               2.00
  bDeviceClass          239 Miscellaneous Device
  bDeviceSubClass         2
  bDeviceProtocol         1 Interface Association
  bMaxPacketSize0        64
  idVendor           0x1d50 OpenMoko, Inc.
  idProduct          0x6018 Black Magic Debug Probe (Application)
  bcdDevice            1.00
  iManufacturer           1 (error)
  iProduct                2 (error)
  iSerial                 3 (error)
  bNumConfigurations      1
  Configuration Descriptor:
    bLength                 9
    bDescriptorType         2
    wTotalLength       0x00f9
    bNumInterfaces          8
    bConfigurationValue     1
    iConfiguration          0
    bmAttributes         0x80
      (Bus Powered)
    MaxPower              100mA
    Interface Association:
      bLength                 8
      bDescriptorType        11
      bFirstInterface         0
      bInterfaceCount         2
      bFunctionClass          2 Communications
      bFunctionSubClass       2 Abstract (modem)
      bFunctionProtocol       1 AT-commands (v.25ter)
      iFunction               0
    Interface Descriptor:
      bLength                 9
      bDescriptorType         4
      bInterfaceNumber        0
      bAlternateSetting       0
      bNumEndpoints           1
      bInterfaceClass         2 Communications
      bInterfaceSubClass      2 Abstract (modem)
      bInterfaceProtocol      1 AT-commands (v.25ter)
      iInterface              4 (error)
      CDC Header:
        bcdCDC               1.10
      CDC Call Management:
        bmCapabilities       0x00
        bDataInterface          1
      CDC ACM:
        bmCapabilities       0x02
          line coding and serial state
      CDC Union:
        bMasterInterface        0
        bSlaveInterface         1
      Endpoint Descriptor:
        bLength                 7
        bDescriptorType         5
        bEndpointAddress     0x82  EP 2 IN
        bmAttributes            3
          Transfer Type            Interrupt
          Synch Type               None
          Usage Type               Data
        wMaxPacketSize     0x0040  1x 64 bytes
        bInterval               4
    Interface Descriptor:
      bLength                 9
      bDescriptorType         4
      bInterfaceNumber        1
      bAlternateSetting       0
      bNumEndpoints           2
      bInterfaceClass        10 CDC Data
      bInterfaceSubClass      0
      bInterfaceProtocol      0
      iInterface              0
      Endpoint Descriptor:
        bLength                 7
        bDescriptorType         5
        bEndpointAddress     0x01  EP 1 OUT
        bmAttributes            2
          Transfer Type            Bulk
          Synch Type               None
          Usage Type               Data
        wMaxPacketSize     0x0200  1x 512 bytes
        bInterval              11
      Endpoint Descriptor:
        bLength                 7
        bDescriptorType         5
        bEndpointAddress     0x81  EP 1 IN
        bmAttributes            2
          Transfer Type            Bulk
          Synch Type               None
          Usage Type               Data
        wMaxPacketSize     0x0200  1x 512 bytes
        bInterval              11
    Interface Association:
      bLength                 8
      bDescriptorType        11
      bFirstInterface         2
      bInterfaceCount         2
      bFunctionClass          2 Communications
      bFunctionSubClass       2 Abstract (modem)
      bFunctionProtocol       0
      iFunction               0
    Interface Descriptor:
      bLength                 9
      bDescriptorType         4
      bInterfaceNumber        2
      bAlternateSetting       0
      bNumEndpoints           1
      bInterfaceClass         2 Communications
      bInterfaceSubClass      2 Abstract (modem)
      bInterfaceProtocol      1 AT-commands (v.25ter)
      iInterface              5 (error)
      CDC Header:
        bcdCDC               1.10
      CDC Call Management:
        bmCapabilities       0x00
        bDataInterface          3
      CDC ACM:
        bmCapabilities       0x02
          line coding and serial state
      CDC Union:
        bMasterInterface        2
        bSlaveInterface         3
      Endpoint Descriptor:
        bLength                 7
        bDescriptorType         5
        bEndpointAddress     0x84  EP 4 IN
        bmAttributes            3
          Transfer Type            Interrupt
          Synch Type               None
          Usage Type               Data
        wMaxPacketSize     0x0040  1x 64 bytes
        bInterval               1
    Interface Descriptor:
      bLength                 9
      bDescriptorType         4
      bInterfaceNumber        3
      bAlternateSetting       0
      bNumEndpoints           2
      bInterfaceClass        10 CDC Data
      bInterfaceSubClass      0
      bInterfaceProtocol      0
      iInterface              0
      Endpoint Descriptor:
        bLength                 7
        bDescriptorType         5
        bEndpointAddress     0x03  EP 3 OUT
        bmAttributes            2
          Transfer Type            Bulk
          Synch Type               None
          Usage Type               Data
        wMaxPacketSize     0x0200  1x 512 bytes
        bInterval               1
      Endpoint Descriptor:
        bLength                 7
        bDescriptorType         5
        bEndpointAddress     0x83  EP 3 IN
        bmAttributes            2
          Transfer Type            Bulk
          Synch Type               None
          Usage Type               Data
        wMaxPacketSize     0x0200  1x 512 bytes
        bInterval               1
    Interface Descriptor:
      bLength                 9
      bDescriptorType         4
      bInterfaceNumber        5
      bAlternateSetting       0
      bNumEndpoints           1
      bInterfaceClass         0
      bInterfaceSubClass      0
      bInterfaceProtocol      0
      iInterface              7 (error)
      Endpoint Descriptor:
        bLength                 7
        bDescriptorType         5
        bEndpointAddress     0x85  EP 5 IN
        bmAttributes            3
          Transfer Type            Interrupt
          Synch Type               None
          Usage Type               Data
        wMaxPacketSize     0x0040  1x 64 bytes
        bInterval              11
    Interface Association:
      bLength                 8
      bDescriptorType        11
      bFirstInterface         4
      bInterfaceCount         1
      bFunctionClass        254 Application Specific Interface
      bFunctionSubClass       1 Device Firmware Update
      bFunctionProtocol       1
      iFunction               6 (error)
    Interface Descriptor:
      bLength                 9
      bDescriptorType         4
      bInterfaceNumber        4
      bAlternateSetting       0
      bNumEndpoints           0
      bInterfaceClass       254 Application Specific Interface
      bInterfaceSubClass      1 Device Firmware Update
      bInterfaceProtocol      1
      iInterface              6 (error)
      Device Firmware Upgrade Interface Descriptor:
        bLength                             9
        bDescriptorType                    33
        bmAttributes                        9
          Will Detach
          Manifestation Intolerant
          Upload Unsupported
          Download Supported
        wDetachTimeout                    255 milliseconds
        wTransferSize                    1024 bytes
        bcdDFUVersion                   1.1a
    Interface Association:
      bLength                 8
      bDescriptorType        11
      bFirstInterface         6
      bInterfaceCount         2
      bFunctionClass          2 Communications
      bFunctionSubClass       2 Abstract (modem)
      bFunctionProtocol       0
      iFunction               0
    Interface Descriptor:
      bLength                 9
      bDescriptorType         4
      bInterfaceNumber        6
      bAlternateSetting       0
      bNumEndpoints           1
      bInterfaceClass         2 Communications
      bInterfaceSubClass      2 Abstract (modem)
      bInterfaceProtocol      1 AT-commands (v.25ter)
      iInterface              8 (error)
      CDC Header:
        bcdCDC               1.10
      CDC Call Management:
        bmCapabilities       0x00
        bDataInterface          7
      CDC ACM:
        bmCapabilities       0x02
          line coding and serial state
      CDC Union:
        bMasterInterface        6
        bSlaveInterface         7
      Endpoint Descriptor:
        bLength                 7
        bDescriptorType         5
        bEndpointAddress     0x87  EP 7 IN
        bmAttributes            3
          Transfer Type            Interrupt
          Synch Type               None
          Usage Type               Data
        wMaxPacketSize     0x0040  1x 64 bytes
        bInterval              10
    Interface Descriptor:
      bLength                 9
      bDescriptorType         4
      bInterfaceNumber        7
      bAlternateSetting       0
      bNumEndpoints           2
      bInterfaceClass        10 CDC Data
      bInterfaceSubClass      0
      bInterfaceProtocol      0
      iInterface              0
      Endpoint Descriptor:
        bLength                 7
        bDescriptorType         5
        bEndpointAddress     0x06  EP 6 OUT
        bmAttributes            2
          Transfer Type            Bulk
          Synch Type               None
          Usage Type               Data
        wMaxPacketSize     0x0200  1x 512 bytes
        bInterval              10
      Endpoint Descriptor:
        bLength                 7
        bDescriptorType         5
        bEndpointAddress     0x86  EP 6 IN
        bmAttributes            2
          Transfer Type            Bulk
          Synch Type               None
          Usage Type               Data
        wMaxPacketSize     0x0200  1x 512 bytes
        bInterval              10
can't get device qualifier: Resource temporarily unavailable
can't get debug descriptor: Resource temporarily unavailable
cannot read device status, Resource temporarily unavailable (11)

